{
  "report_version": "core-2-conformance-report-v1",
  "status": "PASS",
  "total": 10,
  "passed": 10,
  "failed": 0,
  "cases": [
    {
      "name": "basic_pass",
      "case_passed": true,
      "expected_result": "PASS",
      "reason_code": "STATE_RECONSTRUCTED",
      "error": null
    },
    {
      "name": "hash_mismatch_fail",
      "case_passed": true,
      "expected_result": "FAIL",
      "reason_code": "HASH_MISMATCH",
      "error": null
    },
    {
      "name": "invalid_schema_error",
      "case_passed": true,
      "expected_result": "ERROR",
      "reason_code": "INVALID_SNAPSHOT_SCHEMA",
      "error": null
    }
    ,
    {
      "name": "missing_required_field_error",
      "case_passed": true,
      "expected_result": "ERROR",
      "reason_code": "INVALID_SNAPSHOT_SCHEMA",
      "error": null
    },
    {
      "name": "malformed_json_error",
      "case_passed": true,
      "expected_result": "ERROR",
      "reason_code": "INVALID_SNAPSHOT_SCHEMA",
      "error": null
    },
    {
      "name": "unknown_reason_code_error",
      "case_passed": true,
      "expected_result": "ERROR",
      "reason_code": "INTERNAL_ERROR",
      "error": null
    },
    {
      "name": "unsupported_hash_algorithm_error",
      "case_passed": true,
      "expected_result": "ERROR",
      "reason_code": "UNSUPPORTED_HASH_ALGORITHM",
      "error": null
    },
    {
      "name": "wrong_profile_fail",
      "case_passed": true,
      "expected_result": "FAIL",
      "reason_code": "RECONSTRUCTION_RULE_MISMATCH",
      "error": null
    },
    {
      "name": "inside_payload_mutation_detected",
      "case_passed": true,
      "expected_result": "FAIL",
      "reason_code": "HASH_MISMATCH",
      "error": null
    },
    {
      "name": "outside_metadata_ignored",
      "case_passed": true,
      "expected_result": "PASS",
      "reason_code": "STATE_RECONSTRUCTED",
      "error": null
    }
  ]
}
